"Status","Start Time","Stop Time","Duration in ms","Parent Suite","Suite","Sub Suite","Test Class","Test Method","Name","Description"
"failed","Fri Apr 22 06:23:35 GMT 2022","Fri Apr 22 06:48:35 GMT 2022","1500033","","test/sequential/xyk-pallet.test.ts","","test/sequential/xyk-pallet.test.ts","xyk-pallet: Happy case scenario","xyk-pallet: Happy case scenario",""
"failed","Fri Apr 22 06:48:35 GMT 2022","Fri Apr 22 07:13:35 GMT 2022","1500008","","test/sequential/xyk-pallet.test.ts","","test/sequential/xyk-pallet.test.ts","xyk-pallet: Liquidity sufficiency scenario","xyk-pallet: Liquidity sufficiency scenario",""
"failed","Fri Apr 22 08:03:37 GMT 2022","Fri Apr 22 08:28:37 GMT 2022","1500033","","xyk-pallet - treasury tests [Mangata]: on treasury we store","","xyk-pallet - treasury tests [Mangata]: on treasury we store","assets won when assets are bought [Buying Mangata]","assets won when assets are bought [Buying Mangata]",""
"failed","Fri Apr 22 07:38:37 GMT 2022","Fri Apr 22 08:03:37 GMT 2022","1500081","","xyk-pallet - treasury tests [Mangata]: on treasury we store","","xyk-pallet - treasury tests [Mangata]: on treasury we store","assets won when assets are sold [Selling Mangata] - 5","assets won when assets are sold [Selling Mangata] - 5",""
"failed","Fri Apr 22 08:28:37 GMT 2022","Fri Apr 22 08:53:37 GMT 2022","1500028","","xyk-pallet - treasury tests [Mangata]: on treasury we store","","xyk-pallet - treasury tests [Mangata]: on treasury we store","assets won when assets are sold [Selling other in MGA pool] - 6","assets won when assets are sold [Selling other in MGA pool] - 6",""
"failed","Fri Apr 22 08:53:37 GMT 2022","Fri Apr 22 09:18:37 GMT 2022","1500030","","xyk-pallet - treasury tests [Mangata]: on treasury we store","","xyk-pallet - treasury tests [Mangata]: on treasury we store","assets won when assets are bought [Buying other in MGA pool]","assets won when assets are bought [Buying other in MGA pool]",""
