"Status","Start Time","Stop Time","Duration in ms","Parent Suite","Suite","Sub Suite","Test Class","Test Method","Name","Description"
"failed","Thu May 19 07:09:29 GMT 2022","Thu May 19 07:34:29 GMT 2022","1500024","","test/sequential/xyk-pallet.test.ts","","test/sequential/xyk-pallet.test.ts","xyk-pallet: Happy case scenario","xyk-pallet: Happy case scenario",""
"failed","Thu May 19 08:24:31 GMT 2022","Thu May 19 08:49:31 GMT 2022","1500064","","xyk-pallet - treasury tests [Mangata]: on treasury we store","","xyk-pallet - treasury tests [Mangata]: on treasury we store","assets won when assets are sold [Selling Mangata] - 5","assets won when assets are sold [Selling Mangata] - 5",""
"failed","Thu May 19 08:49:31 GMT 2022","Thu May 19 09:14:31 GMT 2022","1500024","","xyk-pallet - treasury tests [Mangata]: on treasury we store","","xyk-pallet - treasury tests [Mangata]: on treasury we store","assets won when assets are bought [Buying Mangata]","assets won when assets are bought [Buying Mangata]",""
"failed","Thu May 19 09:39:31 GMT 2022","Thu May 19 10:04:31 GMT 2022","1500026","","xyk-pallet - treasury tests [Mangata]: on treasury we store","","xyk-pallet - treasury tests [Mangata]: on treasury we store","assets won when assets are bought [Buying other in MGA pool]","assets won when assets are bought [Buying other in MGA pool]",""
"failed","Thu May 19 09:14:31 GMT 2022","Thu May 19 09:39:31 GMT 2022","1500025","","xyk-pallet - treasury tests [Mangata]: on treasury we store","","xyk-pallet - treasury tests [Mangata]: on treasury we store","assets won when assets are sold [Selling other in MGA pool] - 6","assets won when assets are sold [Selling other in MGA pool] - 6",""
"failed","Thu May 19 07:34:29 GMT 2022","Thu May 19 07:59:29 GMT 2022","1500006","","test/sequential/xyk-pallet.test.ts","","test/sequential/xyk-pallet.test.ts","xyk-pallet: Liquidity sufficiency scenario","xyk-pallet: Liquidity sufficiency scenario",""
