"Status","Start Time","Stop Time","Duration in ms","Parent Suite","Suite","Sub Suite","Test Class","Test Method","Name","Description"
"failed","Fri Apr 08 13:11:27 GMT 2022","Fri Apr 08 13:36:28 GMT 2022","1500030","","xyk-pallet - treasury tests [Mangata]: on treasury we store","","xyk-pallet - treasury tests [Mangata]: on treasury we store","assets won when assets are sold [Selling other in MGA pool] - 6","assets won when assets are sold [Selling other in MGA pool] - 6",""
"failed","Fri Apr 08 11:31:26 GMT 2022","Fri Apr 08 11:56:26 GMT 2022","1500010","","test/sequential/xyk-pallet.test.ts","","test/sequential/xyk-pallet.test.ts","xyk-pallet: Liquidity sufficiency scenario","xyk-pallet: Liquidity sufficiency scenario",""
"failed","Fri Apr 08 11:06:26 GMT 2022","Fri Apr 08 11:31:26 GMT 2022","1500029","","test/sequential/xyk-pallet.test.ts","","test/sequential/xyk-pallet.test.ts","xyk-pallet: Happy case scenario","xyk-pallet: Happy case scenario",""
"failed","Fri Apr 08 13:36:28 GMT 2022","Fri Apr 08 14:01:28 GMT 2022","1500027","","xyk-pallet - treasury tests [Mangata]: on treasury we store","","xyk-pallet - treasury tests [Mangata]: on treasury we store","assets won when assets are bought [Buying other in MGA pool]","assets won when assets are bought [Buying other in MGA pool]",""
"failed","Fri Apr 08 12:46:27 GMT 2022","Fri Apr 08 13:11:27 GMT 2022","1500026","","xyk-pallet - treasury tests [Mangata]: on treasury we store","","xyk-pallet - treasury tests [Mangata]: on treasury we store","assets won when assets are bought [Buying Mangata]","assets won when assets are bought [Buying Mangata]",""
"failed","Fri Apr 08 12:21:27 GMT 2022","Fri Apr 08 12:46:27 GMT 2022","1500074","","xyk-pallet - treasury tests [Mangata]: on treasury we store","","xyk-pallet - treasury tests [Mangata]: on treasury we store","assets won when assets are sold [Selling Mangata] - 5","assets won when assets are sold [Selling Mangata] - 5",""
