"Status","Start Time","Stop Time","Duration in ms","Parent Suite","Suite","Sub Suite","Test Class","Test Method","Name","Description"
"failed","Mon Mar 21 18:19:29 GMT 2022","Mon Mar 21 18:44:29 GMT 2022","1500025","","xyk-pallet - treasury tests [Mangata]: on treasury we store","","xyk-pallet - treasury tests [Mangata]: on treasury we store","assets won when assets are bought [Buying other in MGA pool]","assets won when assets are bought [Buying other in MGA pool]",""
"failed","Mon Mar 21 16:14:28 GMT 2022","Mon Mar 21 16:39:28 GMT 2022","1500006","","test/sequential/xyk-pallet.test.ts","","test/sequential/xyk-pallet.test.ts","xyk-pallet: Liquidity sufficiency scenario","xyk-pallet: Liquidity sufficiency scenario",""
"failed","Mon Mar 21 17:04:29 GMT 2022","Mon Mar 21 17:29:29 GMT 2022","1500066","","xyk-pallet - treasury tests [Mangata]: on treasury we store","","xyk-pallet - treasury tests [Mangata]: on treasury we store","assets won when assets are sold [Selling Mangata] - 5","assets won when assets are sold [Selling Mangata] - 5",""
"failed","Mon Mar 21 15:49:28 GMT 2022","Mon Mar 21 16:14:28 GMT 2022","1500037","","test/sequential/xyk-pallet.test.ts","","test/sequential/xyk-pallet.test.ts","xyk-pallet: Happy case scenario","xyk-pallet: Happy case scenario",""
"failed","Mon Mar 21 17:29:29 GMT 2022","Mon Mar 21 17:54:29 GMT 2022","1500024","","xyk-pallet - treasury tests [Mangata]: on treasury we store","","xyk-pallet - treasury tests [Mangata]: on treasury we store","assets won when assets are bought [Buying Mangata]","assets won when assets are bought [Buying Mangata]",""
"failed","Mon Mar 21 17:54:29 GMT 2022","Mon Mar 21 18:19:29 GMT 2022","1500026","","xyk-pallet - treasury tests [Mangata]: on treasury we store","","xyk-pallet - treasury tests [Mangata]: on treasury we store","assets won when assets are sold [Selling other in MGA pool] - 6","assets won when assets are sold [Selling other in MGA pool] - 6",""
