"Status","Start Time","Stop Time","Duration in ms","Parent Suite","Suite","Sub Suite","Test Class","Test Method","Name","Description"
"failed","Fri Jan 28 14:02:01 GMT 2022","Fri Jan 28 14:27:01 GMT 2022","1500025","","xyk-pallet - treasury tests [Mangata]: on treasury we store","","xyk-pallet - treasury tests [Mangata]: on treasury we store","assets won when assets are bought [Buying Mangata]","assets won when assets are bought [Buying Mangata]",""
"failed","Fri Jan 28 12:46:59 GMT 2022","Fri Jan 28 13:11:59 GMT 2022","1500007","","test/sequential/xyk-pallet.test.ts","","test/sequential/xyk-pallet.test.ts","xyk-pallet: Liquidity sufficiency scenario","xyk-pallet: Liquidity sufficiency scenario",""
"failed","Fri Jan 28 12:21:59 GMT 2022","Fri Jan 28 12:46:59 GMT 2022","1500029","","test/sequential/xyk-pallet.test.ts","","test/sequential/xyk-pallet.test.ts","xyk-pallet: Happy case scenario","xyk-pallet: Happy case scenario",""
"failed","Fri Jan 28 13:37:01 GMT 2022","Fri Jan 28 14:02:01 GMT 2022","1500068","","xyk-pallet - treasury tests [Mangata]: on treasury we store","","xyk-pallet - treasury tests [Mangata]: on treasury we store","assets won when assets are sold [Selling Mangata] - 5","assets won when assets are sold [Selling Mangata] - 5",""
"failed","Fri Jan 28 14:52:01 GMT 2022","Fri Jan 28 15:17:01 GMT 2022","1500024","","xyk-pallet - treasury tests [Mangata]: on treasury we store","","xyk-pallet - treasury tests [Mangata]: on treasury we store","assets won when assets are bought [Buying other in MGA pool]","assets won when assets are bought [Buying other in MGA pool]",""
"failed","Fri Jan 28 14:27:01 GMT 2022","Fri Jan 28 14:52:01 GMT 2022","1500026","","xyk-pallet - treasury tests [Mangata]: on treasury we store","","xyk-pallet - treasury tests [Mangata]: on treasury we store","assets won when assets are sold [Selling other in MGA pool] - 6","assets won when assets are sold [Selling other in MGA pool] - 6",""
